{
  "race": {
    "name": "太舞崇礼25K",
    "date": "2026-09-13",
    "distance_km": 25,
    "days_remaining": 69
  },
  "today": {
    "date": "2026-07-06",
    "status": "training",
    "type": "Upper Body + Core",
    "content": "Upper Body + Core 45–60min",
    "duration_min": 60,
    "recovery": "Good",
    "reason": [
      "Week 1 已顺利完成，长距离后恢复总体良好。",
      "今日重点恢复、核心稳定，并观察膝盖反应。",
      "暂不增加速度训练，先验证 Week 2 训练耐受。"
    ]
  },
  "reasons": [
    "Week 1 已顺利完成，长距离后恢复总体良好。",
    "今日重点恢复、核心稳定，并观察膝盖反应。",
    "暂不增加速度训练，先验证 Week 2 训练耐受。"
  ],
  "week": {
    "label": "Week 2",
    "progress": {
      "running_done_km": 0,
      "running_target_km": 21,
      "strength_done": 0,
      "strength_target": 2,
      "long_run_done": 0,
      "long_run_target": 1
    },
    "days": [
      {
        "day": "Mon",
        "status": "planned",
        "type": "Upper Body + Core",
        "content": "45–60min"
      },
      {
        "day": "Tue",
        "status": "planned",
        "type": "Zone2",
        "content": "5km"
      },
      {
        "day": "Wed",
        "status": "planned",
        "type": "Strength",
        "content": "Lower Body"
      },
      {
        "day": "Thu",
        "status": "planned",
        "type": "Recovery",
        "content": "30–40min"
      },
      {
        "day": "Fri",
        "status": "planned",
        "type": "Zone2",
        "content": "6km + 4×30s"
      },
      {
        "day": "Sat",
        "status": "empty",
        "type": "Rest",
        "content": "Rest"
      },
      {
        "day": "Sun",
        "status": "planned",
        "type": "Long Run",
        "content": "9km Zone2"
      }
    ]
  },
  "next_training": {
    "type": "Upper Body + Core",
    "distance": "",
    "intensity": "Recovery + Core Stability",
    "time": "45–60 min",
    "adjustment_type": "Week 2 Start",
    "reason": "恢复、核心稳定、观察膝盖"
  },
  "last_ai_adjustment": {
    "date": "2026-07-05",
    "change": "Week 1 Review + Week 2 Planning",
    "reason": "Week 1 完成质量良好；恢复情况符合预期；Week 2 小幅增加训练量，目标跑量20–21km；继续观察膝盖；当前不建议增加速度训练。",
    "confidence": "High"
  },
  "last_updated": "2026-07-05T21:00:00+08:00"
}
